{
  "format": "stampfly-world",
  "version": 1,
  "units": {
    "length": "m",
    "angle": "deg"
  },
  "frame": "ENU",
  "name": "bedroom",
  "description": {
    "ja": "寝室。ベッドと両脇の小机、本棚、椅子を配置。低い家具と高い家具の間を通り、ベッド下の隙間も確かめる。",
    "en": "A bedroom with a bed, bedside tables, bookshelf and chair. Fly between low and tall furniture and explore the clearance beneath the bed."
  },
  "room": {
    "size": [
      6.0,
      6.0,
      3.0
    ],
    "walls": true,
    "ceiling": true
  },
  "floor": {
    "pattern": "checker",
    "pitch": 0.5,
    "colors": [
      "#deddea",
      "#b8b6cc"
    ],
    "flow_quality": 0.9
  },
  "light": "indoor",
  "spawn": {
    "position": [
      0,
      -2,
      0.05
    ],
    "yaw_deg": 90
  },
  "obstacles": [
    {
      "id": "bed",
      "type": "bed",
      "position": [
        -1.25,
        0.9,
        0
      ],
      "rotation_deg": [
        0,
        0,
        0
      ],
      "size": [
        1.4,
        2,
        0.7
      ],
      "color": "#7c91ac",
      "flow_quality": 0.8
    },
    {
      "id": "bedside_west",
      "type": "table",
      "position": [
        -2.35,
        1.2,
        0
      ],
      "rotation_deg": [
        0,
        0,
        0
      ],
      "size": [
        0.5,
        0.5,
        0.55
      ],
      "color": "#a87950",
      "flow_quality": 0.8
    },
    {
      "id": "bedside_east",
      "type": "table",
      "position": [
        -0.1,
        1.4,
        0
      ],
      "rotation_deg": [
        0,
        0,
        0
      ],
      "size": [
        0.5,
        0.5,
        0.55
      ],
      "color": "#a87950",
      "flow_quality": 0.8
    },
    {
      "id": "wardrobe_shelf",
      "type": "shelf",
      "position": [
        2.1,
        1.7,
        0
      ],
      "rotation_deg": [
        0,
        0,
        -90
      ],
      "size": [
        1,
        0.35,
        1.6
      ],
      "color": "#ad865c",
      "flow_quality": 0.8
    },
    {
      "id": "chair",
      "type": "chair",
      "position": [
        1.3,
        0.1,
        0
      ],
      "rotation_deg": [
        0,
        0,
        -90
      ],
      "size": [
        0.5,
        0.5,
        0.9
      ],
      "color": "#b88b60",
      "flow_quality": 0.8
    }
  ]
}
