{
  "format": "stampfly-world",
  "version": 1,
  "units": {
    "length": "m",
    "angle": "deg"
  },
  "frame": "ENU",
  "name": "stepped_floor",
  "description": {
    "ja": "段差・台・机のある部屋。階段（0.15 m 刻み）と机の上で下向き ToF の値が急に変わる。高度保持の挙動を見る。高台の landing_pad が着陸目標。",
    "en": "A room with steps, a platform and a table. The downward ToF jumps over the 0.15 m staircase and over the table top, exercising altitude hold; landing_pad on the platform is the landing target."
  },
  "room": {
    "size": [
      6.0,
      6.0,
      2.8
    ],
    "walls": true,
    "ceiling": true
  },
  "floor": {
    "pattern": "checker",
    "pitch": 0.4,
    "colors": [
      "#eceff1",
      "#b0bec5"
    ],
    "flow_quality": 0.9
  },
  "light": "indoor",
  "spawn": {
    "position": [
      0.2,
      -2.4,
      0.05
    ],
    "yaw_deg": 90.0
  },
  "obstacles": [
    {
      "id": "step_1",
      "type": "step",
      "position": [
        -1.0,
        -1.2,
        0.0
      ],
      "rotation_deg": [
        0,
        0,
        0
      ],
      "size": [
        1.6,
        0.6,
        0.15
      ],
      "color": "#a1887f",
      "flow_quality": 0.7
    },
    {
      "id": "step_2",
      "type": "step",
      "position": [
        -1.0,
        -0.6,
        0.0
      ],
      "rotation_deg": [
        0,
        0,
        0
      ],
      "size": [
        1.6,
        0.6,
        0.3
      ],
      "color": "#a1887f",
      "flow_quality": 0.7
    },
    {
      "id": "step_3",
      "type": "step",
      "position": [
        -1.0,
        0.0,
        0.0
      ],
      "rotation_deg": [
        0,
        0,
        0
      ],
      "size": [
        1.6,
        0.6,
        0.45
      ],
      "color": "#a1887f",
      "flow_quality": 0.7
    },
    {
      "id": "ramp_down",
      "type": "ramp",
      "position": [
        1.2,
        0.9,
        0.0
      ],
      "rotation_deg": [
        0.0,
        0.0,
        180.0
      ],
      "size": [
        1.0,
        1.2,
        0.45
      ],
      "color": "#8d6e63",
      "flow_quality": 0.7
    },
    {
      "id": "platform",
      "type": "box",
      "position": [
        -1.0,
        0.9,
        0.0
      ],
      "rotation_deg": [
        0,
        0,
        0
      ],
      "size": [
        1.6,
        1.2,
        0.45
      ],
      "color": "#795548",
      "flow_quality": 0.7
    },
    {
      "id": "landing_pad",
      "type": "pad",
      "position": [
        -1.0,
        0.9,
        0.45
      ],
      "rotation_deg": [
        0,
        0,
        0
      ],
      "size": [
        0.5,
        0.5,
        0.01
      ],
      "color": "#ffeb3b",
      "flow_quality": 0.95
    },
    {
      "id": "table_1",
      "type": "table",
      "position": [
        1.3,
        -1.3,
        0.0
      ],
      "rotation_deg": [
        0,
        0,
        0
      ],
      "size": [
        0.9,
        0.7,
        0.6
      ],
      "color": "#6d4c41",
      "flow_quality": 0.6
    }
  ]
}
